{
  "schema_version": "1.0.0",
  "id": "mom_017",
  "tick": 58310,
  "t": 2332.4,
  "period": 1,
  "snapshot_ref": "snap:demo-0001:58310",
  "team": "home",
  "ball_carrier": "H10",
  "moment_type": "counter_attack",
  "origin": "scout",
  "real_action": {
    "intent": {
      "kind": "pass_space",
      "player": "H10",
      "target_player": null,
      "target": [
        38.0,
        -4.0,
        0.0
      ],
      "path": [
        [
          18.4,
          6.1
        ],
        [
          27.0,
          3.0
        ],
        [
          33.0,
          -1.5
        ],
        [
          38.0,
          -4.0
        ]
      ],
      "curve": 0.35,
      "power": 0.62,
      "pass_technique_override": null,
      "shot_technique_override": null,
      "source": "fan"
    },
    "action_type": "pass",
    "body_part": "left_foot",
    "pass_technique": "curled",
    "pass_type": "through_ball",
    "pass_height": "ground",
    "shot_technique": null,
    "intended_end": [
      38.0,
      -4.0,
      0.0
    ],
    "launch": {
      "speed_mps": 17.5,
      "elevation_rad": 0.03,
      "azimuth_rad": -0.52,
      "spin": [
        0.0,
        0.0,
        -8.0
      ]
    },
    "curve_applied": 0.3,
    "ellipse": {
      "center": [
        38.0,
        -4.0,
        0.0
      ],
      "semi_major_m": 1.8,
      "semi_minor_m": 0.9,
      "angle_rad": -0.52
    },
    "preview_arc": [
      [
        18.4,
        6.1,
        0.11
      ],
      [
        25.9,
        3.4,
        0.11
      ],
      [
        32.4,
        -0.6,
        0.11
      ],
      [
        38.0,
        -4.0,
        0.11
      ]
    ],
    "override_rejected": false,
    "weak_foot": false,
    "execution_quality": 0.84
  },
  "real_event_id": "ev_004209",
  "consequence": {
    "kind": "big_chance",
    "xt_swing": 0.28,
    "horizon_s": 10.0,
    "event_ids": [
      "ev_004209",
      "ev_004211"
    ]
  },
  "options": [
    {
      "option_id": "opt_1",
      "intent": {
        "kind": "pass_space",
        "player": "H10",
        "target_player": null,
        "target": [
          38.0,
          -4.0,
          0.0
        ],
        "path": [
          [
            18.4,
            6.1
          ],
          [
            27.0,
            3.0
          ],
          [
            33.0,
            -1.5
          ],
          [
            38.0,
            -4.0
          ]
        ],
        "curve": 0.35,
        "power": 0.62,
        "pass_technique_override": null,
        "shot_technique_override": null,
        "source": "fan"
      },
      "resolved": null,
      "label": "Through ball to Demir",
      "p_success": 0.58,
      "p_success_baseline": 0.49,
      "value_if_success": 0.21,
      "xg": null,
      "xt_gain": 0.176,
      "decision_value": 0.102,
      "viable": true,
      "is_real": true
    },
    {
      "option_id": "opt_2",
      "intent": {
        "kind": "pass_player",
        "player": "H10",
        "target_player": "H02",
        "target": null,
        "path": [],
        "curve": 0.0,
        "power": 0.5,
        "pass_technique_override": null,
        "shot_technique_override": null,
        "source": "ai"
      },
      "resolved": null,
      "label": "Pass to the overlapping Mensah",
      "p_success": 0.86,
      "p_success_baseline": 0.84,
      "value_if_success": 0.09,
      "xg": null,
      "xt_gain": 0.056,
      "decision_value": 0.071,
      "viable": true,
      "is_real": false
    },
    {
      "option_id": "opt_3",
      "intent": {
        "kind": "shot",
        "player": "H10",
        "target_player": null,
        "target": [
          52.5,
          -2.9,
          0.4
        ],
        "path": [],
        "curve": 0.0,
        "power": 0.9,
        "pass_technique_override": null,
        "shot_technique_override": null,
        "source": "ai"
      },
      "resolved": null,
      "label": "Shoot from distance",
      "p_success": 0.03,
      "p_success_baseline": null,
      "value_if_success": 1.0,
      "xg": 0.03,
      "xt_gain": null,
      "decision_value": 0.03,
      "viable": true,
      "is_real": false
    }
  ],
  "scores": {
    "richness": 0.74,
    "stakes": 0.66,
    "consequence": 0.81,
    "salience": 0.9,
    "total": 0.77,
    "viable_options": 3,
    "option_entropy": 1.02
  },
  "flagged": true,
  "hook": "Marchetti had three options on the break. What would you have done?"
}
